15 Things Men Secretly Wish Their Partners Would Say More - Bolde,,https://www.bolde.com/15-things-men-secretly-wish-their-partners-would-say-more/
12 Phrases To Say To Your Partner Way More Often | YourTango,,https://www.yourtango.com/love/magic-phrases-say-your-partner-more-often
3 Things You Should Say to Your Partner More Often | Psychology Today,,https://www.psychologytoday.com/us/blog/social-instincts/202412/3-things-you-should-be-saying-more-often-in-your-relationship
"If a man says these 12 things to you regularly, he sees you as his life partner",,https://www.aconsciousrethink.com/41560/if-a-man-says-these-12-things-to-you-regularly-he-sees-you-as-his-life-partner/
Things Your Husband Wishes You Would Do More Often,,https://www.thelist.com/61557/things-husband-wishes-often/
7 Things Men Wish Women Would Do More Often For Them,,https://mamabeanparenting.com/things-men-wish-women-would-do-more-often-for-them/
,,
Six Crucial Things Men Wish Women Knew - The Good Men Project,,https://goodmenproject.com/featured-content/six-crucial-things-men-wish-women-knew/
What Do Men Really Want? | Psychology Today,,https://www.psychologytoday.com/us/articles/201203/what-do-men-really-want
The Male Mind in Love: Demystifying Men’s Love Journey | A Simplified Psychology Guide,,https://psychology.tips/the-male-mind-in-love-demystifying-mens-love-journey/
20 Things Men Love to Hear From Their Partners,,https://smartrelationshiptips.com/things-men-love-to-hear-from-their-partners/
Men’s Health in Relationships: The Effects of Emotional Labor – BirthForMen,,https://www.birthformen.com/blog/mens-health-in-relationships-the-effects-of-emotional-labor/
,,
Six Misconceptions We Have About Romantic Love,,https://greatergood.berkeley.edu/article/item/six_misconceptions_we_have_about_romantic_love
Age Gaps in Relationships: What Men and Women Prefer | Psychology Today,,https://www.psychologytoday.com/us/blog/the-asymmetric-brain/202501/age-gaps-in-relationships-what-do-men-and-women-prefer
How Relationship Satisfaction Changes Across Your…,,https://greatergood.berkeley.edu/article/item/how_relationship_satisfaction_changes_across_your_lifetime
How Masculinity Is Stifling Men's Sexual Desire | Psychology Today,,https://www.psychologytoday.com/us/blog/myths-desire/201706/how-masculinity-is-stifling-mens-sexual-desire
The Love Profiles That Help (and Hurt) Relationships | Psychology Today,,https://www.psychologytoday.com/us/blog/myths-desire/201706/how-masculinity-is-stifling-mens-sexual-desire
Relationships | Psychology Today,,https://www.psychologytoday.com/us/basics/relationships
Behaviors that Signal Romantic or Sexual Interest | Psychology Today,,https://www.psychologytoday.com/us/blog/the-attraction-doctor/202408/behaviors-that-signal-romantic-or-sexual-interest
15 Habits Of Men Who Are In Relationships For The Long Haul - Bolde,,https://www.bolde.com/habits-of-men-who-are-in-relationships-for-the-long-haul/
The Top Qualities Men Look For In A Lifelong Partner 2025,,https://psychologyorg.com/qualities-men-look-for-in-a-lifelong-partner/
The Benefits of Long-Term Intimate Connections | Psychology Today,,https://www.psychologytoday.com/us/blog/happy-together/202402/the-benefits-of-long-term-intimate-connections
Love and the Brain | Harvard Medical School,,https://hms.harvard.edu/news-events/publications-archive/brain/love-brain
"How Men Build Healthy Relationships: Real Love, Emotional Strength, and Secure Connection — Simon Niblock Therapy — Services for Men | Austin TX",,https://www.simonniblock.com/blog/love-that-grows-you-how-men-do-real-relationships
The Biology of Love: The Science Behind Attraction and Relationships,,https://www.sciencenewstoday.org/the-biology-of-love-the-science-behind-attraction-and-relationships
17 Things Men Love to Hear That Make Them Feel Appreciated,,https://www.sciencenewstoday.org/the-biology-of-love-the-science-behind-attraction-and-relationships
What Every Man Secretly Wants to Hear from His Partner – YAMEE STUDIO,,https://blog.yameestudio.com/what-every-man-secretly-wants-to-hear-from-his-partner/
18 Things Guys Love to Hear,,https://lovewordings.com/things-guys-love-to-hear/
12 Compliments Your Husband Probably Wants To Hear,,https://www.fatherly.com/life/compliments-for-men
enpareja.com/en/news/15-Love-Phrases-Men-Love-to-Hear-According-to-Psychologists-20250618-0008.html,,https://www.enpareja.com/en/news/15-Love-Phrases-Men-Love-to-Hear-According-to-Psychologists-20250618-0008.html
7 Simple Phrases Men LOVE To Hear | Magnetize Your Man,,https://www.magnetizeyourman.com/7-simple-phrases-men-love-to-hear/
What Do Guys Like To Hear? The 4 Most Important Things A Man Needs To Hear - The Healthy Marriage,,https://thehealthymarriage.org/what-do-guys-like-to-hear/
"Guys, Here Are The 17 Emotional Needs Women Wish You Understood Better",,https://www.themodestman.com/emotional-needs-of-women-men-should-know/
9 Things Men Wish Women Knew About Their Emotional Lives,,https://www.budgetandthebees.com/9-things-men-wish-women-knew-about-their-emotional-lives/
10 things men wish women knew but are too afraid to say,,https://rollingout.com/2024/10/31/10-things-men-wish-women-knew/
What Men Wish Women Understood About Emotional Support,,https://www.brainzmagazine.com/post/what-men-wish-women-understood-about-emotional-support
10 Things Men Secretly Wish Women Knew About Them - Housely,,https://housely.com/things-men-secretly-wish-women-knew-about-them/
"4 Core, Emotional Truths Wives Wish Their Husbands Knew | Richard Drobnick | YourTango",,https://www.yourtango.com/love/core-emotional-truths-wives-wish-husbands-knew
Why Understanding A Woman’s Emotional Needs Is Crucial In Relationships,,https://www.guystuffcounseling.com/counseling-men-blog/why-understanding-a-womans-emotional-needs-is-crucial-in-relationships
Men and Emotional Labor: It's Time - The Good Men Project,,https://goodmenproject.com/featured-content/men-and-emotional-labor-its-time/
Why ‘Men Suck’ Might Be a Misunderstanding in Relationships,,https://greatist.com/live/emotional-labor
Navigating Men's Emotions in Relationships: A Guide,,https://greatist.com/live/emotional-labor
From Patriarchy to Poetry: Reclaiming Male Emotions in Love,,https://timeslife.com/relationship/male-emotions-in-love-evolution-of-masculinity/articleshow/116277597.html
What Is ‘Mankeeping’? Justin Pere Quoted in the New York Times on Emotional Labor in Relationships | Couples Therapy and Relationship Therapy Seattle WA,,https://www.claritycounselingseattle.com/blog/mankeeping-justin-pere-quoted-york-emotional-labor-relationships/53011
The Ultimate Guide to Male Emotional Labor,,https://www.numberanalytics.com/blog/ultimate-guide-to-male-emotional-labor
Do You Take on Too Much Emotional Labor in Relationships?,,https://www.psychologytoday.com/us/blog/happy-healthy-relationships/202401/do-you-take-on-too-much-emotional-labor-in-relationships
🌐 20 Expanded Male Emotional URLs,,
,,
Theme,Title & Source,Link
Emotional Needs,10 Emotional Needs of a Man – Marriage.com,https://www.marriage.com/advice/relationship/emotional-needs-of-a-man/
Emotional Vulnerability,The Strength in Vulnerability for Men – Psychology Today,https://www.psychologytoday.com/us/blog/the-male-friendship-experience/202509/the-strength-in-vulnerability-for-men
Emotional Labor,The Ultimate Guide to Male Emotional Labor – NumberAnalytics,https://www.numberanalytics.com/blog/ultimate-guide-to-male-emotional-labor
Emotional Suppression,Male Emotional Suppression – NeuroLaunch,https://neurolaunch.com/male-emotional-suppression/
Emotional Safety,Emotional Safety for Men – Philip Fauerbach Therapy,https://pfauerbachtherapy.com/1161-2emotional-safety-for-men/
Emotional Intelligence,Emotionally Intelligent Men Are Choosing Better Partners – Forbes,https://www.forbes.com/sites/ximenaaraya-fischel/2025/06/16/emotionally-intelligent-men-are-choosing-better-partners-heres-why/
Inner Voice,The Inner Voice That Undermines Relationships – PsychAlive,https://www.psychalive.org/the-inner-voice-that-undermines-your-relationship/
Masculinity & Identity,The Silent Crisis: Deconstructing Men’s Emotional Vulnerability – United We Care,https://www.unitedwecare.com/whitepaper/the-silent-crisis-deconstructing-mens-emotional-vulnerability/
Emotional Boundaries,15 Boundaries Men Should Set – The Modest Man,https://www.themodestman.com/15-boundaries-men-should-set-for-healthier-relationships/
Emotional Complexity,Male Emotions Psychology – NeuroLaunch,https://neurolaunch.com/male-emotions-psychology/
Emotional Growth,Navigating Men’s Emotions in Relationships – NeuroLaunch,https://neurolaunch.com/mens-emotions-in-relationships/
Emotional Expression,Breaking the Stereotype: Emotional Expression for Men – Good Men Project,https://goodmenproject.com/featured-content/breaking-the-stereotype-the-importance-of-emotional-expression-for-men-kpkn/
Emotional Resilience,Building Emotional Resilience in Men – The Integrated Male,https://www.theintegratedmale.com/blog/building-emotional-resilience-in-men-strategies-for-personal-growth
Emotional Labor in Relationships,Why “Mankeeping” Misses the Point – Seb Sauerborn,https://www.sebsauerborn.com/insights-english/mankeeping-men-emotional-labor-equality
Emotional Needs in Conflict,Managing Conflict: Key Skills for Men – The Integrated Male,https://www.theintegratedmale.com/blog/managing-conflict-key-skills-men
Emotional Intimacy,Men Really Want Emotional Intimacy – Psychology Today,https://www.psychologytoday.com/us/blog/demystifying-talk-therapy/202202/men-really-want-emotional-intimacy
Emotional Communication,Understanding Men: Communication & Emotions – Boo,https://boo.world/resources/understanding-men
Emotional Self-Worth,Male Validation Seeking – NeuroLaunch,https://neurolaunch.com/why-do-i-seek-male-validation-psychology/
Emotional Identity,The Psychology of Men in Intimate Relationships – Discover More Podcast,https://www.discovermorepodcast.com/blog/the-psychology-of-men-in-intimate-relationships/
Emotional Attachment,Masculine Voices Predict Attachment Style – PsyPost,https://www.psypost.org/men-with-more-masculine-voices-are-more-avoidantly-attached-and-use-poorer-communication-strategies-within-their-relationships/
